{
  "schema_version": "0.1",
  "kind": "bwp-request",
  "packet_id": "fgv1-t2-agentic-nondeliberate-002",
  "provenance": {
    "operator": "RedEyeNinja",
    "workstream_id": "a8da7a535d294090938e45a3077b14ba",
    "correlation_id": "fgv1-t2-20260822",
    "created_at": "2026-08-22T17:05:00+07:00",
    "supersedes": null,
    "description": "Produce a fleet readiness matrix from live telemetry and current-state observations."
  },
  "intent": {
    "outcome": "Produce a structured fleet readiness matrix covering all inference-capable members: per-member capability, readiness state, context capacity, tools support, and residency, from live telemetry and current-state observations, with an evidence row per member.",
    "non_goals": ["No readiness-state mutation", "No model/provider changes", "No credential access", "No GPU load injection"],
    "sufficiency": {
      "state": "SUFFICIENT",
      "rationale": "Scope (members, attributes, evidence form) is explicit; boundary is read-only telemetry.",
      "adjudicated_by": "Turnstone"
    }
  },
  "work": {
    "work_shape": "agentic",
    "reasoning_intent": "none"
  },
  "requirements": {
    "capabilities_required": ["text_generation", "web_retrieval", "network_access", "structured_extraction", "long_context_processing"],
    "context": {
      "required_inputs": ["operations/fleet-readiness-probe-results-2026-08-21.md"],
      "context_size_requirement": 200000,
      "retrieval_required": true
    },
    "output_budget": 8000,
    "locality": "any",
    "preferences": []
  },
  "authority": {
    "risk_class": "operational",
    "allowed_actions": ["read_files", "run_commands", "access_network", "retrieve_memory", "write_shared_workspace"],
    "forbidden_actions": ["deploy_production", "mutate_configuration", "manage_services", "manage_containers", "create_credentials", "install_packages"],
    "mutation_envelope": {
      "targets": [],
      "allowed_mutations": [],
      "approval_required": false
    },
    "credential_rule": "logical-refs-only"
  },
  "acceptance": {
    "criteria": [
      "Matrix covers every fleet member with named live evidence",
      "Readiness states classified as ready / not-ready / unknown with evidence",
      "No state mutations (read-only proof retained)"
    ]
  },
  "evidence": {
    "requirements": ["read_back", "routing_telemetry", "hash"]
  },
  "control": {
    "timeout_seconds": 3600,
    "cancel_policy": "no re-issue on timeout; classify INDETERMINATE; reconcile target before retry",
    "escalation_conditions": ["a member's live state cannot be established after two probes", "evidence contradicts prior inventory materially"]
  }
}
